title,account_name,source,tags,priority,publish_time,author,digest,url,crawled_at,content_preview,clean_text,ai_summary,importance_score,alert_level,push_status
熔盐储热再出新方案！华电新型多能源协同系统解决管道防冻难题,物理储能,物理储能,,normal,2026-07-02T13:39:37+08:00,,近日，华电新能源集团联合华电电力科学研究院推出全新实用新型专利 ——一种基于熔盐储热系统的多能源协同利用系统，创新采用电磁感应非接触伴热方案，为熔盐储能稳定运行提供全新解法，专利已于 2026 年 6 月 30 日正式授权。,https://mp.weixin.qq.com/s/qPgN3wjPqarTe6-5orVVWw,2026-07-03T08:40:55+08:00,熔盐储热再出新方案！华电新型多能源协同系统解决管道防冻难题 物理储能 [](https://mp.weixin.qq.com/s?__biz=MzU5NjgzNDA0MA==&mid=2247521753&idx=1&sn=062afe30e7104fe335fc02f8cfa92883&scene=21#wechat_redirect) [](https://mp.weixin.qq.com/s?__biz=MzU0NjA4MTg2NA==&mid=2247513118&idx=1&sn=5505223d2ddaa745a2d23d17f5f59b64&scene=21#wechat_red...,熔盐储热再出新方案！华电新型多能源协同系统解决管道防冻难题 物理储能 [](https://mp.weixin.qq.com/s?__biz=MzU5NjgzNDA0MA==&mid=2247521753&idx=1&sn=062afe30e7104fe335fc02f8cfa92883&scene=21#wechat_redirect) [](https://mp.weixin.qq.com/s?__biz=MzU0NjA4MTg2NA==&mid=2247513118&idx=1&sn=5505223d2ddaa745a2d23d17f5f59b64&scene=21#wechat_redirect) 近期热点 熔盐储能凭借大容量、长时供热优势，已成为新型电力系统调峰的核心技术路线，但行业长期存在一大痛点：低温工况下熔盐管路、储罐设备极易凝固堵管，传统伴热能耗高、接触式加热损耗大，制约项目稳定运行。 近日，华电新能源集团联合华电电力科学研究院推出全新实用新型专利 ——一种基于熔盐储热系统的多能源协同利用系统，创新采用电磁感应非接触伴热方案，为熔盐储能稳定运行提供全新解法，专利已于 2026 年 6 月 30 日正式授权。 一、双系统架构，储能 + 伴热一体化设计 整套系统分为两大核心模块： 熔盐循环主系统 由冷盐罐、加热器、热盐罐及配套管路设备组成，承担光伏、风电等新能源富余电力的储热、放热发电核心功能，完成多能源能量存储与输出。 感应熔盐伴热子系统 核心由感应线圈、变频电源、智能控制器构成，摒弃传统电伴热带包裹接触加热模式，将感应线圈缠绕在熔盐管道、核心设备关键区域。 二、电磁涡流非接触加热，直击行业痛点 这套伴热方案的创新核心在于涡流发热原理： 变频电源输出交变电流生成交变磁场，金属管道与设备内部感应出涡流，依靠本体电阻自主发热，全程无需介质接触。 加热均匀无局部过热，杜绝熔盐局部碳化、管路腐蚀； 无导热介质损耗，伴热综合能耗显著降低； 安装维护便捷，线圈外置缠绕，检修不破坏熔盐管路密封结构。 三、多能源协同逻辑，适配风光储一体化场景 系统可匹配风电、光伏低谷富余电力，一方面将电能转化为熔盐热能存储；另一方面利用闲置电力供给感应伴热系统，实现储能供热、管路防冻保温能源同源调配。 完美解决北方冬季、夜间低温环境下熔盐凝固堵管难题，大幅提升长时熔盐储能电站全年可用率，降低机组停机检修频次。 当前国内大规模熔盐储能项目加速落地，管道伴热、低温防冻是保障电站长效经济运行的关键环节。华电这套多能源协同熔盐储热系统，将储能主循环与智能感应伴热深度耦合，兼顾储热发电效率与设备保温安全，为风光熔盐储热电站提供低成本、高可靠的一体化解决方案，助力新型电力系统大容量长时储能规模化落地。 **行业聚焦** •预热！CTE2026 中国热储能与供热大会暨展览会 •首个活动日 | 物理储能通讯录-群内成员开放1天 •会展 | CPE 2026第三届中国物理储能大会暨展览会圆满落幕！ **每月8日活动日，群内成员全开放1天**,,,,pending
中国绿发集团公司副总经理刘军赴青海液态空气储能示范项目主持召开工作协调会,物理储能,物理储能,,normal,2026-07-02T13:39:37+08:00,北京绿发中科储能,6月24日，集团公司副总经理刘军赴青海液态空气储能示范项目现场，主持召开工作协调会，绿发电力公司、青海分公司、储能公司、中国科学院理化所、施工单位、监理单位、设计单位、设备厂家相关人员参会。,https://mp.weixin.qq.com/s/whXgtiKqwZr3GS2qOVgWsw,2026-07-03T08:41:00+08:00,中国绿发集团公司副总经理刘军赴青海液态空气储能示范项目主持召开工作协调会 北京绿发中科储能 北京绿发中科储能 物理储能 [](https://mp.weixin.qq.com/s?__biz=MzU5NjgzNDA0MA==&mid=2247521753&idx=1&sn=062afe30e7104fe335fc02f8cfa92883&scene=21#wechat_redirect) [](https://mp.weixin.qq.com/s?__biz=MzU0NjA4MTg2NA==&mid=2247513118&idx=1&sn=5505223d2ddaa745a2d23d17f5f...,中国绿发集团公司副总经理刘军赴青海液态空气储能示范项目主持召开工作协调会 北京绿发中科储能 北京绿发中科储能 物理储能 [](https://mp.weixin.qq.com/s?__biz=MzU5NjgzNDA0MA==&mid=2247521753&idx=1&sn=062afe30e7104fe335fc02f8cfa92883&scene=21#wechat_redirect) [](https://mp.weixin.qq.com/s?__biz=MzU0NjA4MTg2NA==&mid=2247513118&idx=1&sn=5505223d2ddaa745a2d23d17f5f59b64&scene=21#wechat_redirect) 近期热点 6月24日，集团公司副总经理刘军赴青海液态空气储能示范项目现场，主持召开工作协调会，绿发电力公司、青海分公司、储能公司、中国科学院理化所、施工单位、监理单位、设计单位、设备厂家相关人员参会。 会上，各参建单位依次对项目建设中存在的重点难点问题进行汇报，并对项目调试计划、安全质量问题整改、换热器改造等关键问题展开深入研讨与部署。会议指出，各参建单位要切实压实主体责任，按照项目建设节点计划，坚决完成项目2026年年底满功率发电的目标。一是建立健全快速响应与问题处置机制，组建领导工作组，设计单位、监理单位、设备厂家等单位委派主要分管领导常驻现场，确保项目并网发电工作高效推进；二是要统筹协调各方资源，对于冷箱调试、系统联调等关键调试工作，充分调动内外部专家资源，保障调试工作科学有序实施。三是强化工程建设力量，要求监理单位加强配备专业人员、施工单位增加经验丰富的技术人员，切实做好设备优化、管线试验及检查问题整改工作。 会后，刘军一行深入青海液态空气储能项目现场，对项目建设、安全生产、系统调试等关键环节进行督导。他强调，青海项目作为国家能源局首台（套）重大技术装备、国家新型储能示范项目，在大规模长时储能领域具有重大战略意义，必须高标准、严要求推进。一是要严守安全红线，强化全过程质量管控，确保工程经得起检验；二是要优化调试进度计划，科学统筹资源，确保项目按期并网发电；三是要凝聚思想共识，加强多方协调，高效解决难点问题，着力打造标杆工程。各参建单位要坚定信心、全力以赴、攻坚克难，共同为项目顺利并网发电贡献更多更大力量。 下一步，储能公司将科学组织系统调试、强化安全质量管理，全面保障项目进度，以正确政绩观持续推进青海项目安全高质量并网发电，以实干实绩推动公司储能事业迈上新台阶。 **行业聚焦** •预热！CTE2026 中国热储能与供热大会暨展览会 •首个活动日 | 物理储能通讯录-群内成员开放1天 •会展 | CPE 2026第三届中国物理储能大会暨展览会圆满落幕！ **每月8日活动日，群内成员全开放1天**,,,,pending
中标 | 深能锡林郭勒西乌珠穆沁旗电网侧压缩空气储能项目全过程跟踪审计预中标公示,物理储能,物理储能,,normal,2026-07-02T13:39:37+08:00,,深能锡林郭勒西乌珠穆沁旗电网侧压缩空气储能项目全过程跟踪审计预中标公示,https://mp.weixin.qq.com/s/o_EO2CL0r3Q6f6i-bbJEHQ,2026-07-03T08:41:06+08:00,中标 | 深能锡林郭勒西乌珠穆沁旗电网侧压缩空气储能项目全过程跟踪审计预中标公示 物理储能 [](https://mp.weixin.qq.com/s?__biz=MzU5NjgzNDA0MA==&mid=2247521753&idx=1&sn=062afe30e7104fe335fc02f8cfa92883&scene=21#wechat_redirect) [](https://mp.weixin.qq.com/s?__biz=MzU0NjA4MTg2NA==&mid=2247513118&idx=1&sn=5505223d2ddaa745a2d23d17f5f59b64&scene=21...,中标 | 深能锡林郭勒西乌珠穆沁旗电网侧压缩空气储能项目全过程跟踪审计预中标公示 物理储能 [](https://mp.weixin.qq.com/s?__biz=MzU5NjgzNDA0MA==&mid=2247521753&idx=1&sn=062afe30e7104fe335fc02f8cfa92883&scene=21#wechat_redirect) [](https://mp.weixin.qq.com/s?__biz=MzU0NjA4MTg2NA==&mid=2247513118&idx=1&sn=5505223d2ddaa745a2d23d17f5f59b64&scene=21#wechat_redirect) 近期热点 **行业聚焦** •预热！CTE2026 中国热储能与供热大会暨展览会 •首个活动日 | 物理储能通讯录-群内成员开放1天 •会展 | CPE 2026第三届中国物理储能大会暨展览会圆满落幕！ **每月8日活动日，群内成员全开放1天**,,,,pending
中标 | 华能西安热工院生产项目熔盐储能汽水阀门招标中标候选人公示,物理储能,物理储能,,normal,2026-07-02T13:39:37+08:00,,华能西安热工院生产项目熔盐储能汽水阀门招标中标候选人公示,https://mp.weixin.qq.com/s/noMrMYacQqlecRbF-L3NUg,2026-07-03T08:41:14+08:00,中标 | 华能西安热工院生产项目熔盐储能汽水阀门招标中标候选人公示 物理储能 [](https://mp.weixin.qq.com/s?__biz=MzU5NjgzNDA0MA==&mid=2247521753&idx=1&sn=062afe30e7104fe335fc02f8cfa92883&scene=21#wechat_redirect) [](https://mp.weixin.qq.com/s?__biz=MzU0NjA4MTg2NA==&mid=2247513118&idx=1&sn=5505223d2ddaa745a2d23d17f5f59b64&scene=21#wechat...,中标 | 华能西安热工院生产项目熔盐储能汽水阀门招标中标候选人公示 物理储能 [](https://mp.weixin.qq.com/s?__biz=MzU5NjgzNDA0MA==&mid=2247521753&idx=1&sn=062afe30e7104fe335fc02f8cfa92883&scene=21#wechat_redirect) [](https://mp.weixin.qq.com/s?__biz=MzU0NjA4MTg2NA==&mid=2247513118&idx=1&sn=5505223d2ddaa745a2d23d17f5f59b64&scene=21#wechat_redirect) 近期热点 **行业聚焦** •预热！CTE2026 中国热储能与供热大会暨展览会 •首个活动日 | 物理储能通讯录-群内成员开放1天 •会展 | CPE 2026第三届中国物理储能大会暨展览会圆满落幕！ **每月8日活动日，群内成员全开放1天**,,,,pending
河南洛宁抽水蓄能电站全容量投产发电,物理储能,物理储能,,normal,2026-07-02T13:39:37+08:00,华东咨询,2026年6月30日，由华东咨询承担施工监理任务的河南西部地区首座大型抽水蓄能电站——国网新源河南洛宁抽水蓄能电站4号机组正式投入商业运行，标志着电站全面投产发电，为华中区域迎峰度夏电力保供筑牢坚实屏障，以实绩向中国共产党成立105周年献礼。,https://mp.weixin.qq.com/s/S4vvjJ-PoScABi6peYmmHA,2026-07-03T08:41:18+08:00,河南洛宁抽水蓄能电站全容量投产发电 华东咨询 华东咨询 物理储能 [](https://mp.weixin.qq.com/s?__biz=MzU5NjgzNDA0MA==&mid=2247521753&idx=1&sn=062afe30e7104fe335fc02f8cfa92883&scene=21#wechat_redirect) [](https://mp.weixin.qq.com/s?__biz=MzU0NjA4MTg2NA==&mid=2247513118&idx=1&sn=5505223d2ddaa745a2d23d17f5f59b64&scene=21#wechat_redir...,河南洛宁抽水蓄能电站全容量投产发电 华东咨询 华东咨询 物理储能 [](https://mp.weixin.qq.com/s?__biz=MzU5NjgzNDA0MA==&mid=2247521753&idx=1&sn=062afe30e7104fe335fc02f8cfa92883&scene=21#wechat_redirect) [](https://mp.weixin.qq.com/s?__biz=MzU0NjA4MTg2NA==&mid=2247513118&idx=1&sn=5505223d2ddaa745a2d23d17f5f59b64&scene=21#wechat_redirect) 近期热点 **河南洛宁抽水蓄能电站全容量投产发电** **十载深山鏖战，铸就绿电重器** 2026年6月30日，由华东咨询承担施工监理任务的河南西部地区首座大型抽水蓄能电站——国网新源河南洛宁抽水蓄能电站4号机组正式投入商业运行，标志着电站全面投产发电，为华中区域迎峰度夏电力保供筑牢坚实屏障，以实绩向中国共产党成立105周年献礼。 **PART.01** **豫西“绿色充电宝”全面上线** 作为河南西部地区首座大型抽水蓄能电站、河南省重点能源保障工程、国家“十三五”规划重大能源项目，电站总装机容量140万千瓦，共安装4台单机容量35万千瓦的可逆式水泵水轮发电电动机组。 电站年均发电量11.91亿千瓦时，预计每年可节约标准煤11.8万吨，减少二氧化碳排放31万吨。 **11.91** **11.8** **31** 年均发电量 **（亿千瓦）** 每年节约标准煤 **（万吨）** 每年减排二氧化碳 **（万吨）** 电站的顺利投产发电对于推动华中地区新型电力系统与新型能源体系建设、增强电网新能源消纳能力、优化电源结构、提高电网运行安全水平具有重要意义。 **PART.02** **技术破局！** **国产TBM在抽蓄大直径** **大倾角斜井首次应用** **河南洛宁抽水蓄能电站上、下水库全貌** 该项目首创将引水上斜井、中平洞和下斜井优化成一级斜井方案，开创了国内抽水蓄能电站建井的新模式，其中“永宁号”TBM 承担长度分别为927米、872.979米，倾角分别为 36.236 度和38.742度，直径为7.23米的两条引水斜井开挖工程，掘进地层主要以中风化新鲜斑状花岗岩等Ⅱ、III类围岩为主，并穿越两条断层破碎带。 “永宁号”创下单日最大掘进22.75米、月平均掘进204米的佳绩。确保施工安全的同时，大幅提升了施工效率。 “永宁号”是TBM工法在抽水蓄能电站大直径大倾角斜井工程建设领域的首次应用，也是国产高端装备技术应用在抽水蓄能电站建设的又一次突破，更是我国自主研制敞开式TBM产品技术水平和应用难度的又一次刷新，在我国掘进机产业高质量发展历程中具有里程碑意义。 **PART.03** **微米级精控装配** **雕琢大国储能精品** 地下厂房空间狭窄、工序交叉繁杂，单台机组转子重达425吨，大件转运受限、管线纵横交错，土建、金结、机电、电气多专业同步穿插，整体安装施工难度大。机电安装团队执行严苛微米级装配标准： **▫️**主机设备采用全生命周期三维协同设计与仿真技术，依托数字平台，使制造周期缩短30%以上； **▫️**反复校验间隙、摆度、同轴度核心参数，确保装配标准全面优于设计规范； **▫️**牵头评审机组试运行方案，严格试运行前检查，全程跟踪机组空载、带负荷、15天满负荷试运行，实时记录运行监测数据。 1号机组实现行业首创（高水头机组）无配重稳定运行，机组噪声、油雾抑制效果位居行业前列。2、3、4号机组轴系摆度、导轴承间隙、密封漏水量控制值远低于设计允许上限，500kV高压电气设备、油气水管路安装工艺规整，二次电缆布线整齐规范，保护传动校验零差错。 **PART.04** **绿色建造赋能** **绘就深山生态答卷** 项目始终秉持“绿色施工、生态优先”理念，将低碳环保、生态保护贯穿工程建设全周期，实现工程建设与绿水青山和谐共生。地下厂房、开关站创新采用装配式施工，监理搭建“出厂抽检—吊装拼接—密封防渗”全链条管控流程。相较传统现浇施工，大幅减少高支模作业，缩短工期30%，实现减尘降噪、节约建材的绿色建造目标。 为最大程度的做好环境保护，洛宁抽水蓄能电站将上下库连接路、业主营地通行路部分路段及开关站通行路由明挖改为洞挖，上下库连接道路总长11.9km，设置隧洞4条，最大程度减少对生态环境的破坏。 项目拌合站更是采用了全封闭型拌合站，搭配高效污水处理系统，从源头控制扬尘与污水排放。 院副总经理吴世东一行现场检查 未来，这座扎根豫西深山的“绿色充电宝”，将持续释放清洁电能，护航电网安全稳定运行，赋能新型能源体系建设，为区域...,,,,pending
Agent的自演进，被刚刚开源的AReaL 2.0按下了加速键,机器之心,机器之心,"AI, 大模型, 产业动态",high,2026-07-02T13:30:00+08:00,关注Agent的,Agent既要会做事，也要从做过的事里学到东西 — AReaL 2.0旨在为这一进程提供系统支持。,https://mp.weixin.qq.com/s/qehsKZfTs2WDggV80BkGfg,2026-07-03T08:30:34+08:00,Agent的自演进，被刚刚开源的AReaL 2.0按下了加速键 原创 关注Agent的 关注Agent的 机器之心 编辑｜杜伟 当 Agent 从演示视频中的炫技片段开始走进真实工作流与生产环境，下一阶段的「何去何从」成为业界关注的焦点。 最近，Claude Code 创造者 Boris Cherny 在一次访谈节目中透露，「在 Anthropic 内部，几乎 100% 的工程师都在同时运行 100 多个带有自我改进循环的 Agent【1】。这样的能力让它们在每次运行中不断变得更好」。此外 Anthropic 也发布了名为《When AI builds itself》的深度报告，其中提到当前...,Agent的自演进，被刚刚开源的AReaL 2.0按下了加速键 原创 关注Agent的 关注Agent的 机器之心 编辑｜杜伟 当 Agent 从演示视频中的炫技片段开始走进真实工作流与生产环境，下一阶段的「何去何从」成为业界关注的焦点。 最近，Claude Code 创造者 Boris Cherny 在一次访谈节目中透露，「在 Anthropic 内部，几乎 100% 的工程师都在同时运行 100 多个带有自我改进循环的 Agent【1】。这样的能力让它们在每次运行中不断变得更好」。此外 Anthropic 也发布了名为《When AI builds itself》的深度报告，其中提到当前 AI 正在接管自身的研发流程，未来将迈向递归自我改进【2】。 种种迹象表明，Agent 正面临着又一次关键的节点：从「会使用工具并完成任务」转向「在使用中学习并改进完成任务的方法」。 但现实是，Agent 可以在软件工程、客服、科研助理等真实场景任务中运行，却很难在运行中变强。它们每天都会产生大量交互轨迹，包括成功路径、失败步骤、用户修正、工具调用结果等。可问题在于这些数据与经验大多只被当作日志或监控信息，用于排查问题，很少被系统化地转化为下一轮能力提升。 这背后暴露出的，是 Agent 进入生产阶段后的一大缺口。破局点在什么地方？由蚂蚁联合香港科技大学、清华大学组成的 AReaL 团队认为，自演进的障碍不只停留在单一 RL 算法层面，而在于缺少一套面向真实智能体服务的在线强化学习系统基础设施。 作为一个开箱即用的 Agentic RL 训练底座，3 月初发布的 AReaL v1.0 解决的重点是如何高效进行大规模异步 RL 训练以及让 Agent 一键接入 RL 训练。而今天上线的 AReaL 2.0，将问题边界进一步推到了 Agent 服务侧：真实部署中的 Agent 如何通过「会话式交互、轨迹采集、奖励绑定和异步训练」进入一个在线学习闭环？ AReaL 2.0 给出了自己的答案，「既不要求开发者重写 Agent，也不需要现有业务系统推倒重来」。 它的核心思路是：将原本服务于 Rollout 和训练的计算单元重组为可部署、可接入、可替换的 Agent-compute 微服务组件。这样一来，只要将 Agent 原本的 LLM 推理后端切换到 AReaL 2.0 管理的入口，就可以在尽量少改动原有规划、工具调用、沙箱和记忆模块的前提下，把真实交互流引入在线 RL 闭环。 目前，AReaL 2.0 的技术报告已经放出。 * 论文标题：Next-Generation Agentic Reinforcement Learning Systems Enable Self-Evolving Agents * 项目主页：https://github.com/areal-project/AReaL Agent 自演进，首先要有学习闭环 要让 Agent 真正从使用中学习，首先要解决一个基础的问题：真实工作流里发生的一切如何被转化为可学习、可治理、可回放的经验。 在 AReaL 2.0 的系统构想中，自演进 Agent 需要三根支柱：Agent Trajectory Data Protocol、Agentic Data Proxy 以及 Agent Evolution Control Plane。 首先来看第一根支柱 ——Agent Trajectory Data Protocol（ATDP），也就是面向学习的智能体轨迹协议。 普通日志通常会记录用户问了什么、模型答了什么、调用了哪个工具、有没有报错、延迟多少、花了多少 token。对调试来说，这些信息有用；但对训练一个要从经验中变强的 Agent 来说，还远远不够。 在 AReaL 团队看来，一个真正可学习的轨迹需要以步骤为单位记录完整决策过程：当时 Agent 观察到了什么，内部状态或 harness 是什么，选择了什么动作以及动作产生了什么结果，奖励或反馈在什么时候到达以及模型版本、工具版本、租户、成本、权限、治理状态等元数据。 总之，一次复杂任务被拆分为可追责、可回放、可归因的学习样本。只有这样，系统才能回答更关键的问题：到底是哪一次检索、哪一个工具调用、哪条 prompt 片段、哪段记忆影响到了任务成败？ 接下来是第二根支柱 —— 企业级 Agentic Data Proxy。ATDP 定义了「应该记录什么」，而 Data Proxy 解决的是「在真实生产系统里如何记录」。 Agent 往往同时连接模型、工具、检索系统、记忆系统、人类反馈渠道、文件系统和浏览器动作。并且不同团队可能使用不同 Agent 框架，不同租户有不同数据权限，不同业务线也有不同合规边界。如果只是把所有轨迹先堆成日志，再事后...,,,,pending
