title,account_name,source,tags,priority,publish_time,author,digest,url,crawled_at,content_preview,clean_text,ai_summary,importance_score,alert_level,push_status
【行业资讯】国务院印发“十五五”碳达峰行动方案：推动新型储能规模化发展，大力发展长时储能,国际储能技术与产业联盟,国际储能技术与产业联盟,,normal,2026-07-17T15:57:05+08:00,,日前，国务院印发《“十五五”碳达峰行动方案》（以下简称《行动方案》），对“十五五”时期碳达峰工作作出部署。,https://mp.weixin.qq.com/s/hD-o8JOjMlKDcOl_OvnS_A,2026-07-18T08:39:00+08:00,【行业资讯】国务院印发“十五五”碳达峰行动方案：推动新型储能规模化发展，大力发展长时储能 国际储能技术与产业联盟 **日前，国务院印发《“十五五”碳达峰行动方案》（以下简称《行动方案》），对“十五五”时期碳达峰工作作出部署。** 行动方案指出，加快提升电力系统新能源消纳能力。支持新能源就地消纳，积极发展绿电直连、新能源就近接入增量配电网等绿电直供模式，推动源网荷储一体化发展。因地制宜加快建设抽水蓄能电站；推动新型储能规模化发展，大力发展长时储能；挖掘需求侧调节潜力，加快虚拟电厂发展，推动可调节负荷等各类分散资源参与系统调节。逐步明确重点用能行业可再生能源消费最低比重目标。到2030年，抽水蓄能...,【行业资讯】国务院印发“十五五”碳达峰行动方案：推动新型储能规模化发展，大力发展长时储能 国际储能技术与产业联盟 **日前，国务院印发《“十五五”碳达峰行动方案》（以下简称《行动方案》），对“十五五”时期碳达峰工作作出部署。** 行动方案指出，加快提升电力系统新能源消纳能力。支持新能源就地消纳，积极发展绿电直连、新能源就近接入增量配电网等绿电直供模式，推动源网荷储一体化发展。因地制宜加快建设抽水蓄能电站；推动新型储能规模化发展，大力发展长时储能；挖掘需求侧调节潜力，加快虚拟电厂发展，推动可调节负荷等各类分散资源参与系统调节。逐步明确重点用能行业可再生能源消费最低比重目标。到2030年，抽水蓄能装机容量达到1.6亿千瓦左右，新型储能装机容量力争达到3亿千瓦，全国虚拟电厂最大调节能力达到5000万千瓦以上，电力需求响应能力达到最大用电负荷的5%以上。 **国务院关于印发《“十五五”碳达峰行动方案》的通知** 国发〔2026〕22号 各省、自治区、直辖市人民政府，国务院各部委、各直属机构： 现将《“十五五”碳达峰行动方案》印发给你们，请认真贯彻执行。 国务院 2026年7月5日 （本文有删减） **“十五五”碳达峰行动方案** “十五五”时期是实现碳达峰的关键期、攻坚期。为贯彻落实党中央、国务院决策部署，积极稳妥推进和实现碳达峰，加快经济社会发展全面绿色转型，根据生态环境法典和《碳达峰碳中和综合评价考核办法》等有关要求，制定本方案。 **一、总体要求** 坚持以习近平新时代中国特色社会主义思想为指导，深入贯彻党的二十大和二十届历次全会精神，认真落实四中全会部署，完整准确全面贯彻新发展理念，发挥碳达峰碳中和战略牵引作用，更好统筹保障能源安全和经济社会发展，以能源绿色低碳转型为关键，深入推进产业绿色化、低碳化，更高水平、更高质量做好节能降碳工作，稳步实现煤炭和石油消费达峰，将绿色低碳导向融入国民经济循环各领域各环节，加快形成绿色生产生活方式，培育更多绿色经济增长点，厚植高质量发展绿色底色。 到2030年，我国单位国内生产总值二氧化碳排放比2025年降低17%，非化石能源消费占比达到25%，确保如期实现碳达峰目标，为实现2035年国家自主贡献目标、推进碳中和奠定坚实基础。 **二、加快能源结构调整优化** （一）大力推进非化石能源开发。坚持风光水核等多能并举，更大力度发展新能源，统筹开发布局和消纳利用，扩大非化石能源有效供给。建设“三北”风电光伏、西南水风光一体化、沿海核电、海上风电等清洁能源基地，积极发展分布式光伏、分散式风电，推动光热发电、海洋能发电规模化发展，因地制宜利用生物质能、地热能，布局建设风光氢氨醇一体化基地。加快推进新增用电量由新增清洁能源电量覆盖。到2030年，风电和太阳能发电总装机容量达到28亿千瓦以上，常规水电装机容量达到4.1亿千瓦左右，核电运行装机容量达到1.1亿千瓦左右。 （二）加快提升电力系统新能源消纳能力。适应新能源发展趋势，强化电力系统对新能源的接纳、配置和调控能力。提升跨省跨区输电和互补互济能力，加快特高压外送通道建设，新增西电东送能力8000万千瓦以上，大力推进省间电力互济工程建设。支持新能源就地消纳，积极发展绿电直连、新能源就近接入增量配电网等绿电直供模式，推动源网荷储一体化发展。持续扩大电力系统调节资源规模，坚持生态优先、需求导向、优化布局，因地制宜加快建设抽水蓄能电站；推动新型储能规模化发展，大力发展长时储能；挖掘需求侧调节潜力，加快虚拟电厂发展，推动可调节负荷等各类分散资源参与系统调节。逐步明确重点用能行业可再生能源消费最低比重目标。到2030年，抽水蓄能装机容量达到1.6亿千瓦左右，新型储能装机容量力争达到3亿千瓦，全国虚拟电厂最大调节能力达到5000万千瓦以上，电力需求响应能力达到最大用电负荷的5%以上。 （三）深入推进煤炭消费清洁替代。合理控制煤电装机规模和发电量，推动煤电向支撑性调节性电源转型，支持煤电与新能源融合发展。开展煤电机组低碳化改造，在不影响供热前提下开展北方地区热电联产机组热电解耦改造，支持热电厂储热设施建设。加强高效节能煤电机组及其辅机研发攻关与推广应用。依法依规全面淘汰关停不符合环保、能耗、用煤、安全、年限等要求的煤电机组（含自备机组），大力推动自备机组参与电网调峰。推进煤化工低碳化改造，降低单位产品煤耗及碳排放，支持煤化工项目与绿电、绿氢耦合发展。大力推进燃煤锅炉、燃煤工业窑炉清洁替代，全面淘汰10蒸吨/小时及以下燃煤锅炉，分行业领域逐步替代中小燃煤锅炉。“一企一策”推动用煤企业开展控煤减煤。支持有条件的地方对新建非“两高”项目实施煤炭消费等量或减量替代。 （四）持续优化油气消费结构。积极推进绿色氢氨醇、生物柴油、可持续航空燃料等绿色燃料应用。有序推进化工用油替代，探...,,,,pending
【科技动态】国内外氢能最新进展研究,国际储能技术与产业联盟,国际储能技术与产业联盟,,normal,2026-07-17T15:57:05+08:00,朱勇 张挺编译,四川大学揭示Pd掺杂提升V基储氢合金抗空气中毒机制文章信息技术领域：V基BCC储氢合金空气中毒抗性与Pd掺杂改,https://mp.weixin.qq.com/s/oQIIzhc97sP5znnkxzv9tg,2026-07-18T08:38:54+08:00,"【科技动态】国内外氢能最新进展研究 朱勇 张挺编译 朱勇 张挺编译 国际储能技术与产业联盟 ****四川大学揭示Pd掺杂提升V基储氢合金抗空气中毒机制**** 文章信息 技术领域：V基BCC储氢合金空气中毒抗性与Pd掺杂改性 开发单位：四川大学新能源与低碳技术研究院、教育部替代能源材料与器件工程研究中心，严义刚、王倩等。 文章名称：Qian Wang, Qingfeng Xie, et al. Improving the Air Poisoning Resistance of V−Ti−Cr−Fe Hydrogen Storage Alloys through Pd-Mediated Hydr...","【科技动态】国内外氢能最新进展研究 朱勇 张挺编译 朱勇 张挺编译 国际储能技术与产业联盟 ****四川大学揭示Pd掺杂提升V基储氢合金抗空气中毒机制**** 文章信息 技术领域：V基BCC储氢合金空气中毒抗性与Pd掺杂改性 开发单位：四川大学新能源与低碳技术研究院、教育部替代能源材料与器件工程研究中心，严义刚、王倩等。 文章名称：Qian Wang, Qingfeng Xie, et al. Improving the Air Poisoning Resistance of V−Ti−Cr−Fe Hydrogen Storage Alloys through Pd-Mediated Hydrogen Dissociation. ACS Applied Energy Materials, 2025. 技术突破：首次系统揭示Pd掺杂对V基BCC合金空气中抗中毒性能的作用机制，发现0.5–1 at.%微量Pd掺杂即可在不损失储氢容量的前提下，将V75Ti11Cr13Fe1合金的空气中毒抗性提升近10倍；Pd原子固溶于合金晶格中不形成第二相，形成氢扩散通道，促进H₂解离扩散并抑制表面氧化；含250 ppm空气的氢气环境下循环10次后，Pd掺杂合金容量保留率约70%，而原始合金仅为7.5%；Pd掺杂同时显著改善活化性能，掺杂≥0.5 at.% Pd合金无需高温活化即可在室温直接吸氢；DFT计算证实Pd位点兼具高氢解离催化活性与强抗氧化稳定性。 应用价值：为解决V基储氢合金在实际工业氢气环境下循环寿命短的问题提供了经济有效的改性策略，微量Pd掺杂即可实现显著抗中毒效果，对推动V基BCC合金在固态储氢、氢纯化及氢能储运等领域的实用化进程具有重要指导意义。 V基BCC结构储氢合金凭借室温下≥2.4 wt%的可逆储氢容量，性能优于商业化AB5型和AB2型合金，被认为是最具潜力的室温固态储氢材料之一。然而，V基合金对氢气中的微量杂质气体极为敏感，即使是ppm级的空气也会在合金表面形成氧化物钝化层，导致吸氢容量快速衰减。例如，V40Fe8Ti32Cr20合金在含250 ppm O2的氢气中仅循环4次就完全失活，严重制约了V基合金的实际应用。如何在保持高储氢容量的同时提升合金的抗空气中毒性能，是该领域亟待突破的关键难题。 来自四川大学新能源与低碳技术研究院的严义刚团队以V75Ti11Cr13Fe1合金为基体，通过电弧熔炼法制备了不同Pd含量的(V75Ti11Cr13Fe1)100-xPdx（x=0, 0.05, 0.5, 1, 2）系列合金，系统研究了Pd掺杂对合金抗空气中毒性能的影响及作用机制。研究发现，Pd原子以置换方式固溶于BCC晶格中，不形成第二相，晶格参数随Pd含量增加而线性增大。性能测试表明，0.5–1.0 at.% Pd掺杂的合金在50℃下脱氢容量仍保持2.50 wt%以上，与原始合金相当；而在含250 ppm空气的氢气环境中循环10次后，原始合金容量衰减高达92.5%（仅保留7.5%），0.5 at.% Pd合金容量衰减仅为31.6%（保留约70%），2.0 at.% Pd合金衰减进一步降至16.2%。XPS分析证实Pd掺杂有效抑制了Ti、V、Cr等元素的表面氧化，金属态的Ti比例从17%提升至28%，V从18%提升至29%。DFT计算进一步揭示，Pd位点既能高效催化H2解离，又具有较强的抗氧化稳定性，形成氢扩撒通道选择性地让氢分子通过并阻挡氧气侵蚀。此外，Pd掺杂还显著改善了合金的活化性能，≥0.5 at.% Pd的合金无需高温活化即可在室温直接吸氢。这项研究提出的微量Pd掺杂策略，为提升V基储氢合金的环境适应性和循环寿命开辟了新途径。（编译：张哲雨 INESA） 图1 不同含量Pd掺杂合金循环容量衰减率 图2 (a) 0.05at.% Pd掺杂(c) 2 at.% Pd掺杂吸氢测试曲线 **推荐相关阅读：** **韩国POSTECH团队利用可解释机器学习揭示TiMn2型储氢合金元素效应** 文章信息 技术领域：TiMn2型AB2固态储氢合金、机器学习辅助材料设计 开发单位：韩国浦项科技大学（POSTECH）材料科学与工程系、韩国科学技术研究院（KIST）氢能材料研究中心、延世大学材料科学与工程系，Byeong-Joo Lee等。 文章名称：Jaemin Wang, Byeong-Joo Lee, et al. Discovering elemental effects on hydrogen storage in TiMn₂-type alloys using explainable machine learning. Acta Materialia, 2025. 技术突破：开发了基于图神经网络AlloyGCN的机器学习框架，整...",,,,pending
【科技动态】国内外抽水蓄能技术最新研究进展,国际储能技术与产业联盟,国际储能技术与产业联盟,,normal,2026-07-17T15:57:05+08:00,徐德厚 编译,南京水利科学研究院开展了抽水蓄能电站进/出水口涡漩特性及控制措施模型试验研究文章信息技术领域：抽水蓄能电站水力,https://mp.weixin.qq.com/s/jVaJnxWT2js3P-XPd3X3UQ,2026-07-18T08:38:47+08:00,【科技动态】国内外抽水蓄能技术最新研究进展 徐德厚 编译 徐德厚 编译 国际储能技术与产业联盟 **南京水利科学研究院开展了抽水蓄能电站进/出水口涡漩特性及控制措施模型试验研究** 文章信息 技术领域：抽水蓄能电站水力学；进/出水口水力特性与涡漩控制。 开发单位：南京水利科学研究院水文水资源与水利工程科学国家重点实验室，江苏 南京 210029；余凯文，韩昌海，韩康，石俊峰。 文章名称：余凯文，韩昌海，韩康，等. 抽水蓄能电站进/出水口涡漩特性及控制措施模型试验研究\[J\]. 水电能源科学，2025. 技术突破：通过大比尺水工模型试验，揭示了抽水蓄能电站侧式进/出水口涡漩随水位降低的演变规律...,【科技动态】国内外抽水蓄能技术最新研究进展 徐德厚 编译 徐德厚 编译 国际储能技术与产业联盟 **南京水利科学研究院开展了抽水蓄能电站进/出水口涡漩特性及控制措施模型试验研究** 文章信息 技术领域：抽水蓄能电站水力学；进/出水口水力特性与涡漩控制。 开发单位：南京水利科学研究院水文水资源与水利工程科学国家重点实验室，江苏 南京 210029；余凯文，韩昌海，韩康，石俊峰。 文章名称：余凯文，韩昌海，韩康，等. 抽水蓄能电站进/出水口涡漩特性及控制措施模型试验研究\[J\]. 水电能源科学，2025. 技术突破：通过大比尺水工模型试验，揭示了抽水蓄能电站侧式进/出水口涡漩随水位降低的演变规律，并创新性地提出了双层消涡梁横纵交错布置方案，有效消除了有害的吸气吸物涡漩。 应用价值：研究成果为抽水蓄能电站进/出水口的涡漩识别、安全评估及消涡结构设计提供了直接的试验依据和工程解决方案，有助于保障电站安全稳定运行。 抽水蓄能电站的进/出水口有进水和出水两种运行工况，双向水流的水力条件复杂。在进/出水口前易产生水库环流或形成漩涡，恶化进/出水口的水流条件，进/出水口前是否出现有漩涡是衡量进/出水口设计合理性和运行工况可靠性的重要标准。近年来，随着水电能源的开发，尤其是抽水蓄能电站的高速发展，进/出水口的涡漩问题日益突出。因此，需要对进/出水口的漩涡问题展开专门研究。 南京水利科学研究院水文水资源与水利工程科学国家重点实验室的研究人员，基于大比尺水工模型试验，研究了抽水蓄能电站侧式进/出水口漩涡特性及其控制措施，旨在为抽水蓄能电站进/出水口漩涡问题的研究提供参考。依托某抽水蓄能电站，基于大比尺水工模型试验，研究了抽水蓄能电站侧式进/出水口涡漩的特征及其控制措施。结果表明，进/出水口涡漩的形态及强度与进/出水口淹没水深有关，当进/出水口前的运行水位由正常蓄水位逐渐降低时，进/出水口前开始出现涡漩，且涡漩的直径随淹没水深增加先增大后逐渐减小，当水位降低至死水位时，进/出水口前的涡漩间歇性吸入漂浮物和气体。为消除间歇性吸气吸物涡漩，进行了6组消涡方案试验，提出双层横纵交错的消涡梁布置方案，有效解决了某抽水蓄能电站上库侧式进/出水口涡漩问题。研究结果可为抽水蓄能电站进/出水口涡漩问题的研究提供参考。(编译: 徐德厚 INESA) 图1某抽水蓄能电站上库进/出水口消涡梁布置方案 **推荐相关阅读：** **西北农林科技大学开展了全功率可变速抽水蓄能机组在不同条件下甩负荷的动态特性研究** 文章信息 技术领域：全功率可变速抽水蓄能。 开发单位：西北农林科技大学水利与建筑工程学院，陕西 咸阳 712100；刘璋，刘公成，张云鹏等。 文章名称：刘璋，刘公成，张云鹏，等. 全功率可变速抽水蓄能机组在不同条件下甩负荷的动态特性研究\[J\]. 振动与冲击，2025. 技术突破：基于特征性法建立了耦合变速特性的抽水蓄能机组精细化模型，揭示了初始转速与导叶关闭规律对甩负荷过程水力特性及安全性的影响规律。 应用价值：研究成果可为全功率变速抽水蓄能机组在甩负荷工况下的安全运行与导叶关闭规律优化提供理论依据与决策支持，有助于提升机组在电网调峰调频过程中的运行稳定性与安全性。 可变速抽水蓄能机组已成为世界抽水蓄能行业的新趋势。特别是与传统定速抽水蓄能机组相比，可变速抽水蓄能机组具有高效、灵活、快速和可靠等优点因此，可变速抽水蓄能机组的安全性和稳定性对于提高电网的整体安全性和稳定性具有重要意义。 为了研究全功率变速抽水蓄能机组甩负荷工况下的动态特性和安全性问题，来自西北农林科技大学的研究人员，在基于特征线法构建的抽水蓄能机组调节系统精细化模型基础上结合全功率变速机组的变速特性，首先探究了不同初始运行转速下全功率变速机组在600 m和额定水头工况的甩负荷过程中的水力特性演变规律；然后分析了不同导叶关闭规律下定速机组和全功率变速机组甩负荷过程中的水力特性。通过对比两种机组的甩负荷关键性指标，评估了全功率变速机组在甩负荷工况下的安全性。结果表明，全功率变速机组的初始转速越低，在甩负荷工况下的安全稳定性越强；在导叶拒动情况下，全功率变速机组与定速机组的转速、蜗壳压力、尾水管压力均发生振荡，且两种机组安全性大致相同；在具有不同关闭速率的直线关闭规律工况下，全功率变速机组甩负荷过渡过程的安全性优于定速机组；而“先快后慢”导叶关闭规律中的两个关闭速率、导叶开度拐点以及“先慢后快”导叶关闭规律中的导叶开度拐点都会降低全功率变速机组甩负荷过程的安全裕量，不利于运行的稳定性和安全性。研究成果可为全功率变速抽水蓄能机组的甩负荷运行提供决策支持。(编译: 徐德厚 INESA) 图1不同初始运行转速下全功率可变速抽水蓄能机组甩负荷工况动态响应 **国际储能技术与产业联盟** 国际储能技术与产业联盟...,,,,pending
丹麦技术研究院高级顾问Martin StagePihl Andersen 确认出席第十六届热泵行业年会（2026）,热泵在线,热泵在线,,normal,2026-07-17T15:55:44+08:00,,,https://mp.weixin.qq.com/s/yqBSTYO6h0CTAJUexzqlOw,2026-07-18T08:44:38+08:00,丹麦技术研究院高级顾问Martin StagePihl Andersen 确认出席第十六届热泵行业年会（2026） 热泵在线 [](https://mp.weixin.qq.com/s?__biz=MjM5NzU5NDA4MQ==&mid=2649642829&idx=1&sn=af400ee1c04cf6fd29cbdd766e8b4a0d&scene=21#wechat_redirect),丹麦技术研究院高级顾问Martin StagePihl Andersen 确认出席第十六届热泵行业年会（2026） 热泵在线 [](https://mp.weixin.qq.com/s?__biz=MjM5NzU5NDA4MQ==&mid=2649642829&idx=1&sn=af400ee1c04cf6fd29cbdd766e8b4a0d&scene=21#wechat_redirect),,,,pending
中国科学院理化技术研究所副所长/研究员罗二仓确认出席第十六届热泵行业年会（2026）,热泵在线,热泵在线,,normal,2026-07-17T15:55:44+08:00,,,https://mp.weixin.qq.com/s/8Hb6rdXVuACJCJ3Ob_agHA,2026-07-18T08:44:34+08:00,中国科学院理化技术研究所副所长/研究员罗二仓确认出席第十六届热泵行业年会（2026） 热泵在线 [](https://mp.weixin.qq.com/s?__biz=MjM5NzU5NDA4MQ==&mid=2649642829&idx=1&sn=af400ee1c04cf6fd29cbdd766e8b4a0d&scene=21#wechat_redirect),中国科学院理化技术研究所副所长/研究员罗二仓确认出席第十六届热泵行业年会（2026） 热泵在线 [](https://mp.weixin.qq.com/s?__biz=MjM5NzU5NDA4MQ==&mid=2649642829&idx=1&sn=af400ee1c04cf6fd29cbdd766e8b4a0d&scene=21#wechat_redirect),,,,pending
习近平在世界人工智能大会上讲话的金句来了！,国际能源研究中心,国际能源研究中心,,normal,2026-07-17T15:54:42+08:00,新华社,,https://mp.weixin.qq.com/s/Kng35Er-97kZC18gj1A8_A,2026-07-18T08:39:22+08:00,习近平在世界人工智能大会上讲话的金句来了！ 新华社 新华社 国际能源研究中心,习近平在世界人工智能大会上讲话的金句来了！ 新华社 新华社 国际能源研究中心,,,,pending
OpenAI为何推出ChatGPT联名篮球？,IEEE电气电子工程学会,IEEE电气电子工程学会,待补fakeid,normal,2026-07-17T15:50:00+08:00,AmandaSilberling,"点击蓝字 关注我们SUBSCRIBE to USImage Credits:OpenAI, edited by",https://mp.weixin.qq.com/s/9JPotpoUGxRSFa67W7S_pA,2026-07-18T08:32:50+08:00,"OpenAI为何推出ChatGPT联名篮球？ AmandaSilberling AmandaSilberling IEEE电气电子工程师学会 **SUBSCRIBE** **to US** **Image Credits:**OpenAI, edited by TechCrunch 想必大家都听说了，OpenAI近日推出自家首款硬件：一款售价230美元的迷你键盘。但很多人不知道，除了这款用于智能自主任务操作的“指令控制中枢”之外，OpenAI还同步上架了一款ChatGPT主题篮球。 商品详情页介绍称：“这款篮球出自‘停下・运动・提问（Pause. Play. Prompt）’品牌活动，以实物提...","OpenAI为何推出ChatGPT联名篮球？ AmandaSilberling AmandaSilberling IEEE电气电子工程师学会 **SUBSCRIBE** **to US** **Image Credits:**OpenAI, edited by TechCrunch 想必大家都听说了，OpenAI近日推出自家首款硬件：一款售价230美元的迷你键盘。但很多人不知道，除了这款用于智能自主任务操作的“指令控制中枢”之外，OpenAI还同步上架了一款ChatGPT主题篮球。 商品详情页介绍称：“这款篮球出自‘停下・运动・提问（Pause. Play. Prompt）’品牌活动，以实物提醒人们，创意并非只局限于电子屏幕之内。”我在OpenAI官网没有找到任何关于这场“停下・运动・提问”活动的其他相关内容，但我猜测，OpenAI是想用这种方式提醒大家，不要一整天都泡在代码模型Codex里。 谁说科技企业不关心我们的心理健康？ 这款篮球售价70美元，这笔钱差不多相当于GPT-5五千六百万输入token的调用成本。球体采用全橡胶材质，相比职业赛场专用的高档真皮篮球，它耐候性更强，更适合户外打球。 生成式AI浪潮持续升温，各大科技公司的碳排放量也随之攀升，即便如此，OpenAI仍畅想大家能多出门运动，想到这点我（作者，以下简称我）心里颇有感触。 实在很难想象这款ChatGPT篮球的目标受众究竟是谁，它到底是卖给什么人的？ 如果走出满脑子AI、一心疯狂刷token的硅谷圈子，带着一颗ChatGPT篮球去球场，恐怕都要被旁人调侃取笑。就算有人给我70美元，我也绝不会拿着这颗球出现在费城社区球场。不过话说回来，AI行业本就不擅长打造贴合市场需求的产品，这点倒是能为这款ChatGPT篮球辩解一二。想想Humane AI Pin惨淡收场，便可窥见一二。 除了这款售价70美元的趣味周边，OpenAI还上架了一系列印有励志标语的文创服饰，其中一句是“优质研究，厚积薄发”。在我看来，初创企业创始人见急于催增速的投资人时，穿这件衣服再合适不过。 还有一款售价175美元的半拉链卫衣，衣身以花体字印着“研究”二字，自带一种难以言喻的独特格调。商品详情页写道，这款卫衣“利落挺括的衣领，让人追忆起我们的学术岁月”。 微信号｜IEEE电气电子工程师学会 新浪微博｜IEEE中国 Bilibili | IEEE中国 **· IEEE电气电子工程师学会 ·** 对这位工程师而言，一堂业余电子兴趣课改变了一切 机器人行业迈向真实应用，专家关注2026年关键转变 聚变初创企业商用反应堆设计获重大进展 如何减少对智能手机的依赖？",,,,pending
