title,account_name,source,tags,priority,publish_time,author,digest,url,crawled_at,content_preview,clean_text,ai_summary,importance_score,alert_level,push_status
碳讯 |  远景拿下德国最大规模储能项目,环球零碳,环球零碳,,normal,2026-07-02T22:45:39+08:00,环球零碳研究所,,https://mp.weixin.qq.com/s/rtWuXnVAszR6VszGaLmrug,2026-07-03T08:41:40+08:00,碳讯 | 远景拿下德国最大规模储能项目 环球零碳研究所 环球零碳研究所 环球零碳 **环球零碳** **碳中和领域的《新青年》** _**01**_ **远景拿下德国最大规模储能项目** 近日，在刚落幕的Intersolar Europe 2026期间，远景科技集团与全球独立电力生产商Elements Green正式签署合作协议，双方将共同推进德国北部Stadorf电池储能系统项目。该项目容量达400MW/1600MWh，是德国目前规模最大的储能项目之一，标志着远景新型电力系统战略在欧洲核心市场实现又一重大突破。 据悉，Stadorf项目采用远景最新Gen 8储能系统解决方案，具备四小时储能时...,碳讯 | 远景拿下德国最大规模储能项目 环球零碳研究所 环球零碳研究所 环球零碳 **环球零碳** **碳中和领域的《新青年》** _**01**_ **远景拿下德国最大规模储能项目** 近日，在刚落幕的Intersolar Europe 2026期间，远景科技集团与全球独立电力生产商Elements Green正式签署合作协议，双方将共同推进德国北部Stadorf电池储能系统项目。该项目容量达400MW/1600MWh，是德国目前规模最大的储能项目之一，标志着远景新型电力系统战略在欧洲核心市场实现又一重大突破。 据悉，Stadorf项目采用远景最新Gen 8储能系统解决方案，具备四小时储能时长、先进电池技术与智能电网集成能力。作为德国目前规模最大的储能项目之一，该项目面临复杂工程设计、电网接入及合规等多重挑战。远景将提供系统级集成解决方案，应对高标准要求，为德国及欧洲大型储能基础设施建设树立新标杆。 6月份，远景动力刚与储能系统集成企业Prevalon Energy达成战略合作，未来三年，远景动力将向Prevalon供应超10GWh高品质储能电芯及模组，支持其公用事业级储能项目落地，满足新能源并网、电网可靠性保障、AIDC（人工智能数据中心）电力基础设施等场景的全球需求。 远景已率先将新型电力系统能力转化为出海竞争力：一方面持续带动风机、储能电芯、储能系统等硬件设备订单增长；另一方面，AI电力系统、风光储一体化解决方案等也持续受到海外客户青睐，推动中国新能源出海全面迈向系统能力输出的新阶段。 **（来源：renewablesnow）** _**02**_ **央企新能源巨头首日开盘，市值一度突破3900亿** 7月2日，华润新能源（SZ：01248）正式登陆深交所主板。公司开盘较发行价10.11元高开超110%报21.6元/股，总市值约2800亿元。公司股价最高攀升至30.16元/股，市值一度突破3900亿元。 这是深交所史上募资规模最大的一单IPO。根据发行安排，华润新能源此次募集资金总额约245亿元，甚至比2020年金龙鱼约139亿元的融资规模还要高出76%。与此同时，华润新能源也是2023年A股全面注册制落地后，首家按照新规则走完主板IPO全流程的红筹企业。 华润新能源恰是华润旗下主营风光发电投资运营的核心平台。截至2025年末，华润新能源主要资产覆盖国内31个省份，控股发电项目并网装机容量达4158.99万千瓦，占全国市场份额约2.26%，位居行业前列。其中风力发电项目装机2763.07万千瓦，占全国市场份额4.32%；太阳能发电项目装机1395.92万千瓦，占全国市场份额1.16%。 **（来源：华夏能源网）** _**03**_ **光伏能耗能效国标发布** 据央视新闻报道，工业和信息化部消息7月2日发布三项光伏领域强制性国家标准，围绕硅料、硅片、光伏组件、逆变器全链条划定能耗能效刚性约束，以标准化手段完善光伏产业链绿色管控体系，为新能源产业高质量发展提供制度支撑。 工业和信息化部联合国家发展改革委、国家市场监督管理总局发布《硅单晶单位产品能源消耗限额》《晶体硅光伏组件和逆变器能效限定值及能效等级》《硅多晶和锗单位产品能源消耗限额》三项光伏能耗能效强制性国家标准，覆盖多晶硅、硅片、组件、逆变器等光伏产业链关键环节，分等级设定相关产品能耗能效指标，严控各环节高耗能低效产能；针对组件，创新纳入耦合环境应力衰减率评价指标。 据了解，三项标准系统衔接、协同发力，既提高光伏产品绿色准入门槛，促进光伏产业转型升级；又统一全链条能耗能效核算规则，促进光伏这一绿色能源更加绿色低碳。 **（来源：央视新闻）** _**04**_ **贵州拟清理4.147GW风光项目，涉及国电投、华能、华电等** 7月1日，贵州省能源局发布关于清理贵州省2026年第一批风电光伏发电项目建设计划的通知。 通知指出，为推动贵州省新能源产业高质量发展，推进资源有效开发利用，现对纳入省年度建设计划未在规定期限内完成核准备案、逾期未开工建设和主动放弃的风电、光伏发电项目进行清理，共计53个、装机414.7万千瓦。 其中，涉及305.7万千瓦风电项目、109万千瓦光伏项目。 这些项目设计的企业包括国家能源集团、中广核、华电集团、国家电投、华能集团等。 **（来源：贵州能源局）** _**05**_ **交通部：加快电动化和绿色燃料车船应用** 6月30日，交通部在官网发布了《关于完善现代化都市圈综合交通运输体系的指导意见》。 在推动交通运输绿色化转型方面，指导意见提出，推进都市圈交通基础设施绿色化更新改造。推进都市圈补能设施“连点成线组网”，拓展主要货运节点及周边区域中短途补能设施网络。建设零碳运输走廊示范路段（航段）和零碳枢纽场站、服务区。推进沿江沿海都市圈...,,,,pending
华润新能源上市首日市值突破3000亿元！,国际能源研究中心,国际能源研究中心,,normal,2026-07-02T22:20:22+08:00,能研学社,,https://mp.weixin.qq.com/s/H5IFoI-tnQnES0UP4JwybQ,2026-07-03T08:36:35+08:00,华润新能源上市首日市值突破3000亿元！ 原创 能研学社 能研学社 国际能源研究中心 7月2日，深交所史上最大IPO华润新能源（001248）正式登陆主板。开盘报21.60元，较发行价10.11元大涨113.65%；开盘仅2分钟即触发临停；盘中最高触及30.16元，涨幅达198.32%。收盘报23.95元，涨幅136.89%，市值3115亿元。 市场究竟在为什么买单？ ▌装机涨了64%，利润跌了26% 华润新能源的质地无可挑剔。截至2025年末，控股装机4158.99万千瓦，占全国市场份额2.26%；风电平均利用小时2307小时、光伏1295小时，均显著高于行业均值；业务覆盖全国31个省份。2...,华润新能源上市首日市值突破3000亿元！ 原创 能研学社 能研学社 国际能源研究中心 7月2日，深交所史上最大IPO华润新能源（001248）正式登陆主板。开盘报21.60元，较发行价10.11元大涨113.65%；开盘仅2分钟即触发临停；盘中最高触及30.16元，涨幅达198.32%。收盘报23.95元，涨幅136.89%，市值3115亿元。 市场究竟在为什么买单？ ▌装机涨了64%，利润跌了26% 华润新能源的质地无可挑剔。截至2025年末，控股装机4158.99万千瓦，占全国市场份额2.26%；风电平均利用小时2307小时、光伏1295小时，均显著高于行业均值；业务覆盖全国31个省份。245亿元募资将投向717.5万千瓦新增装机——这是典型的“国家队”优质资产。 但翻开招股书，另一组数字令人不安。 2023年至2025年，装机规模增长64%，归母净利润却从82.80亿元跌至61.02亿元，下降26.3%。2026年一季度，净利润同比再降31%；公司预计上半年净利润33亿至38亿元，同比下降19%至29%。 装机在涨，利润在跌。中间被吃掉的是电价。 过去三年，风电平均上网电价从0.45元/千瓦时降至0.35元，光伏从0.37元降至0.28元。每度电少卖一毛钱，乘以每年数百亿度的发电量，就是几十亿利润蒸发。 ▌136号文终结“保量保价”时代 电价下跌不是华润新能源一家的问题。2025年1月，国家发改委、能源局发布136号文，终结了新能源“保量保价”时代。此前，新能源项目85%的电量按燃煤基准价保价收购；此后，增量项目全部进入电力市场。 华润新能源保障性上网电量占比，已从2023年的70.38%降至2025年的49.64%。一半电量已暴露在市场价格波动中。 整个行业都在经历同样的阵痛。五家纯新能源资产发电央企2025年净利润平均降幅达40%。三峡能源2025年利润总额同比下降41.55%。 “越大越不赚钱” ！这已不是某一家公司的困境，而是整个新能源发电行业的结构性命题。 ▌50倍PE是信仰还是泡沫？ 华润新能源发行市盈率21.99倍，略高于行业均值20.86倍。但首日收盘价对应的市盈率已超过50倍。 对比两个参照物：三峡能源2021年上市，发行价2.65元，首日涨停后连拉6个涨停板；龙源电力2022年回A，首日即破发，大跌22.87%。区别在于估值——龙源定价太高，市场不买账；三峡给了二级市场足够空间。 华润新能源的定价锚定在“绿电资产稀缺性”与“新型电力系统建设”的交汇点上。在“双碳”目标纵深推进的背景下，优质风光发电资产正经历一轮“确定性溢价”重估。 但“稀缺性”能撑起50倍市盈率吗？ 一家2025年净利润61亿、2026年上半年预计同比下降近30%的公司，市场给出的估值已远超其业绩所能支撑的范畴。 华润新能源的首日表现，是一场资本对“绿电龙头”稀缺性的热情投票。但热情之外，136号文带来的电价市场化改革正在深刻改写行业逻辑。当“保量保价”的时代落幕，新能源发电企业从“固定电价”的温室被推向现货市场，却还没有足够的管理价格风险的工具。 50倍市盈率买的究竟是资产的未来，还是对旧时代的最后追忆？ 答案或许不在今天的K线里，而在下一个季度的电价报表中。 （本文观点仅供参考，不构成任何投资建议）,,,,pending
"""十五五""时期新兴产业、未来产业与服务业协同联动发展研究",战略前沿技术,战略前沿技术,,normal,2026-07-02T22:18:27+08:00,宏观经济研究部,远望智库：与智者同行，为创新加速！,https://mp.weixin.qq.com/s/-RghfFQkHYTvbx9ftzLq_w,2026-07-03T08:37:05+08:00,"""十五五""时期新兴产业、未来产业与服务业协同联动发展研究 战略前沿技术 以下文章来源于新华国研经济学研究院 ，作者宏观经济研究部 **新华国研经济学研究院** . 聚焦国家战略，围绕国民经济发展，推动以战略实施为导向的策略性研究、开展以解决问题为导向的对策性研究，积极探索发展方略、制度创新、丰富理论研究与实践。 电话 | 010-82030532 手机 | 18501361766 微信 | tech9999 邮箱 | yw@techxcope.com **来源：新华国研经济学研究院** **作者：宏观经济研究部** 摘 要：""十五五""时期是中国从制造大国迈向制造强国的关键阶段，新兴产业、未来产...","""十五五""时期新兴产业、未来产业与服务业协同联动发展研究 战略前沿技术 以下文章来源于新华国研经济学研究院 ，作者宏观经济研究部 **新华国研经济学研究院** . 聚焦国家战略，围绕国民经济发展，推动以战略实施为导向的策略性研究、开展以解决问题为导向的对策性研究，积极探索发展方略、制度创新、丰富理论研究与实践。 电话 | 010-82030532 手机 | 18501361766 微信 | tech9999 邮箱 | yw@techxcope.com **来源：新华国研经济学研究院** **作者：宏观经济研究部** 摘 要：""十五五""时期是中国从制造大国迈向制造强国的关键阶段，新兴产业、未来产业与服务业的协同联动发展，是构建现代化产业体系、培育新质生产力的核心路径。本文以""十五五""规划纲要为政策框架，系统梳理了新兴产业、未来产业与服务业协同发展的理论基础与内在逻辑，全面分析了""十四五""时期中国新兴产业、高技术制造业与服务业的各自发展成就及协同态势，深入解读了""十五五""规划对三大领域协同发展的战略部署。在此基础上，从技术创新协同、产业链协同、要素配置协同、区域布局协同、制度环境协同五个维度，构建了三者协同联动的分析框架，剖析了当前协同发展面临的主要障碍与挑战，并提出了""十五五""时期推动新兴产业、未来产业与服务业深度融合、协同发展的系统性路径与政策建议。 关键词：十五五规划；新兴产业；未来产业；服务业；协同发展；现代化产业体系 第一章 绪论 **一、研究背景与问题提出 进入""十四五""时期以来，中国经济在复杂多变的国际环境中保持了稳健发展态势。2025年，全年国内生产总值达到1401879亿元，比上年增长5.0%，经济总量稳居世界第二位。与此同时，中国经济发展正处于从要素驱动向创新驱动转变的关键时期，产业结构的深度调整和转型升级成为推动高质量发展的核心命题。在这一进程中，新兴产业、未来产业与服务业的协同联动发展，日益成为构建现代化产业体系、培育新质生产力的关键路径。 从全球视角来看，新一轮科技革命和产业变革正在加速演进。人工智能、量子信息、生物技术、新能源等前沿技术群体性突破，正在深刻重塑全球产业分工格局和国际竞争格局。主要发达国家纷纷加大对新兴产业和未来产业的战略投入，同时高度重视生产性服务业对制造业的赋能作用。美国通过《芯片与科学法案》强化半导体等战略性产业布局，欧盟推出""工业5.0""战略推动制造业与服务业深度融合，日本发布""新资本主义""增长战略聚焦数字经济与绿色转型。在这一全球竞争格局下，中国迫切需要推动新兴产业、未来产业与服务业的协同发展，以形成整体竞争优势。 从国内发展需求来看，中国制造业增加值已连续16年位居世界第一，但""大而不强""的问题依然突出。制造业在高端芯片、工业软件、精密仪器等领域的核心技术受制于人，产业链供应链的韧性和安全水平有待提升。与此同时，服务业增加值占GDP比重已达57.7%，连续11年占据国民经济""半壁江山""，但生产性服务业发展水平与发达国家相比仍有差距，知识密集型服务业占比偏低，对制造业的赋能作用尚未充分发挥。新兴产业虽然发展迅速，但在基础研究、关键核心技术、标准体系等方面仍存在短板。因此，推动三大领域的协同联动发展，既是破解当前发展瓶颈的现实需要，也是把握新一轮科技革命机遇的战略选择。 2026年3月，十四届全国人大四次会议表决通过了《中华人民共和国国民经济和社会发展第十五个五年规划纲要》，将""建设现代化产业体系，巩固壮大实体经济根基""置于战略布局的突出位置。规划纲要第二篇专门设立第四章""优化提升传统产业""、第五章""培育壮大新兴产业和未来产业""、第六章""促进服务业优质高效发展""，形成了传统产业、新兴产业和未来产业、服务业协同发展的完整政策框架。这一制度安排体现了中央对产业发展规律的深刻把握和对协同发展的高度重视。 在此背景下，系统研究""十五五""时期新兴产业、未来产业与服务业协同联动发展问题，具有重要的理论价值和现实意义。从理论层面看，需要深入阐释三大领域协同发展的内在逻辑和动力机制，丰富和拓展产业经济学和创新经济学的理论框架。从实践层面看，需要全面评估""十四五""时期三大领域的发展成就与协同态势，准确把握""十五五""时期的战略导向与政策重点，科学识别协同发展面临的主要障碍，进而提出具有针对性和可操作性的发展路径与政策建议。 **二、研究意义** 本研究的理论意义主要体现在以下方面：第一，构建新兴产业、未来产业与服务业协同发展的分析框架，有助于深化对现代化产业体系内部结构关系的理论认识。第二，将产业协同置于""十五五""规划和新质生产力发展的双重语境下进行考察，有助于揭示产业协同发展的新特征、新规律。第三，通过分析三大领域在技术创新、产业链、要素配置、区域布局、制度环境等维度的协同机制，丰富产业协同理论的内...",,,,pending
全球大语言模型使用趋势与区域差异,战略前沿技术,战略前沿技术,,normal,2026-07-02T22:18:27+08:00,远望智库预见未来,远望智库：与智者同行，为创新加速！,https://mp.weixin.qq.com/s/uPFcfb4wSTj5Arwpa-IA-w,2026-07-03T08:37:11+08:00,全球大语言模型使用趋势与区域差异 原创 远望智库预见未来 远望智库预见未来 战略前沿技术 电话 | 010-82030532 手机 | 18501361766 微信 | tech9999 邮箱 | yw@techxcope.com **全球大语言模型使用趋势与区域差异 本文摘自《中美人工智能市场竞争——分析大语言模型的全球使用模式》| 远望译品 1.全球大语言模型使用趋势 图1显示了我们对大语言模型使用情况的分析结果。图A（左上角）显示了美国和中国大语言模型服务的每月总访问量；图B（右上角）仅显示中国大语言模型的网站访问量，并突显了DeepSeek的显著增长；图C（底部）显示了中国大语言模型在...,全球大语言模型使用趋势与区域差异 原创 远望智库预见未来 远望智库预见未来 战略前沿技术 电话 | 010-82030532 手机 | 18501361766 微信 | tech9999 邮箱 | yw@techxcope.com **全球大语言模型使用趋势与区域差异 本文摘自《中美人工智能市场竞争——分析大语言模型的全球使用模式》| 远望译品 1.全球大语言模型使用趋势 图1显示了我们对大语言模型使用情况的分析结果。图A（左上角）显示了美国和中国大语言模型服务的每月总访问量；图B（右上角）仅显示中国大语言模型的网站访问量，并突显了DeepSeek的显著增长；图C（底部）显示了中国大语言模型在全球市场中的份额。 图1 大语言模型使用情况分析（2024年4月至2025年8月） 不出所料，我们发现，根据Similarweb的使用数据衡量，全球大语言模型市场正在经历快速增长。从2024年4月到2025年5月，主要大语言模型平台的网站访问量增长了三倍，从每月24亿次访问量增至近78亿次（图1，面板A）。 在这一增长期间，美国模型始终保持着压倒性的市场主导地位，截至2025年5月，占据了全球大语言模型网站访问量的约92%。 DeepSeekR1发布后，中国大语言模型的月访问量从2024年12月的1.36亿次增至2025年2月的7.63亿次——短短两个月内增长了461%（图1，面板B）。值得注意的是，DeepSeek的激增并没有挤占其他中国模型的流量，这些模型的流量在此期间也持续增长。相反，DeepSeek的成功扩大了中国大语言模型的整体市场。 结果是，中国大语言模型的全球市场份额在两个月内从3%飙升至13%（图1，面板C）。此后，由于中国模型的用户量下降，而美国模型的用户量持续增长，中国模型的市场份额在2025年8月降至约6%。 这一6%的数字与其他数据来源的估算大致吻合。根据追踪移动应用程序下载量的SensorTower公司的数据，截至2025年6月，DeepSeek在手机上的下载安装量约为ChatGPT和Gemini下载量总和的十分之一。OpenRouter是一家汇总开源模型（不包括较新的ChatGPT模型）代币使用量的平台，该公司报告称，截至2025年8月，中国开发的模型在其服务中处理的代币总量约占16%。此外，清华大学的研究人员估计，截至2025年7月中旬，中国模型的市场份额不到10%。 最后值得注意的是，ChatGPT于2024年7月在中国停止服务对ChatGPT的全球用户增长影响微乎其微，而ChatGPT-4o的图像生成功能于2025年3月推出后，显著增加了ChatGPT的流量。 2．区域差异 中国大语言模型的采用模式在不同地区差异很大。图2显示了我们数据集中所有135个国家/地区中，以DeepSeek为主的中国大语言模型所获得的市场份额增长情况。该图比较了DeepSeek发布前后（2024年4月至12月与2025年1月至5月）中国大语言模型的市场份额。各国根据中国大语言模型市场份额增长的幅度进行分类：增长幅度最小（5%或以下，黄色）、中等增长（5%至10%，橙色）和显著增长（超过10%，红色）。 流量数据显示，2025年，中国大语言模型在全球总使用量中的份额在所有国家/地区都有所增长。如图2所示，增长幅度最大的国家（红色）包括俄罗斯以及中东、非洲和南美洲的一些国家。这些国家要么是发展中国家，要么与中国有着密切的政治和经济联系。相比之下，增长幅度较小的国家主要位于欧洲、澳大利亚、东亚和南亚（浅黄色）。这些国家大多是北大西洋公约组织的成员国，是美国的盟友，或与美国在印太战略方面进行合作。 图2 DeepSeekR1发布后，全球对基于中国的大语言模型模型的使用情况发生了变化 相关性分析表明，DeepSeekR1发布后，各国在中国大语言模型市场份额与人均国内生产总值（GDP）之间呈现显著的负相关关系（r=-0.25；p=0.007），这表明发展中国家的采用率更高。即使在控制了前一年的大语言模型市场份额和政治体制类型后，这种关系仍然具有统计学意义，这表明经济因素——而不仅仅是政治立场或先前的使用模式——在推动中国模型的采用方面发挥了重要作用。 图3突显了中国大语言模型采用率的显著增长；它比较了DeepSeek发布前后30个国家的市场渗透率。各国按2025年中国大语言模型在该国的市场份额进行排名（右图）。 在DeepSeekR1发布之前（左图），中国大语言模型的市场渗透率仅在中国大陆和香港地区具有意义；这些模型在世界其他地区的用量可以忽略不计。2025年，DeepSeek发布后，中国模型在11个国家的市场份额超过20%，并在30个国家的渗透率超过10%（右图）。值得注意的是，在我们包含135个国家的数据集中，每个国家从2024年到20...,,,,pending
