title,account_name,source,tags,priority,publish_time,author,digest,url,crawled_at,content_preview,clean_text,ai_summary,importance_score,alert_level,push_status
总投资超200亿元！河北氢氧化铝新材料项目2027年底投产,铝途有你,铝途有你,,normal,2026-07-17T23:32:30+08:00,,,https://mp.weixin.qq.com/s/bV0Bq2jGDBiql8scCRFJUQ,2026-07-18T08:52:18+08:00,总投资超200亿元！河北氢氧化铝新材料项目2027年底投产 铝途有你 总投资超200亿元！河北氢氧化铝新材料项目2027年底投产#铝加工#铝加网#河北#氢氧化铝,总投资超200亿元！河北氢氧化铝新材料项目2027年底投产 铝途有你 总投资超200亿元！河北氢氧化铝新材料项目2027年底投产#铝加工#铝加网#河北#氢氧化铝,,,,pending
欧盟再生铝一体化创新项目介绍,铝途有你,铝途有你,,normal,2026-07-17T23:24:45+08:00,文三千,,https://mp.weixin.qq.com/s/HflWDF92XW5qrsHPpgYamw,2026-07-18T08:52:22+08:00,欧盟再生铝一体化创新项目介绍 原创 文三千 文三千 铝途有你 一、基础项目概况 1\. 全称、立项与资金 CLEANMAT = Smart Clean Aluminium Material Processing（智能洁净铝物料加工） 资助方：欧盟地平线欧洲（Horizon Europe）科研计划 启动时间：2026 年 6 月，项目周期 36 个月（3 年） 总预算：733 万欧元 牵头单位：英国布鲁内尔大学（Brunel University London） 合作联盟：横跨欧洲多国共17家合作方，覆盖高校科研院所、再生铝工厂、冶金设备商、铝行业协会、政策研究机构 ### 2\. 立项核心背景...,欧盟再生铝一体化创新项目介绍 原创 文三千 文三千 铝途有你 一、基础项目概况 1\. 全称、立项与资金 CLEANMAT = Smart Clean Aluminium Material Processing（智能洁净铝物料加工） 资助方：欧盟地平线欧洲（Horizon Europe）科研计划 启动时间：2026 年 6 月，项目周期 36 个月（3 年） 总预算：733 万欧元 牵头单位：英国布鲁内尔大学（Brunel University London） 合作联盟：横跨欧洲多国共17家合作方，覆盖高校科研院所、再生铝工厂、冶金设备商、铝行业协会、政策研究机构 ### 2\. 立项核心背景（行业痛点）传统再生铝工艺三大顽疾，也是项目攻关目标： ### **2.1 熔剂消耗大、盐渣处置难：熔炼依赖大量盐类熔剂除杂，产生海量盐渣；盐渣固废处置成本极高、环保法规持续收紧，是全球再生铝行业最难管控污染物；** **2.2 混杂废铝品质失控：汽车、建筑、家电报废铝料牌号混杂，含 Fe/Cu/Zn 金属杂质、油漆 / 塑料 / 油污有机涂层，难以稳定产出高端汽车、罐用再生合金；** **2.3 废气与高降级损耗：传统脱漆、熔炼产生颗粒物、VOC、二噁英；废料纯度不足只能降级低端使用，大量高价值废铝外流出口亚洲，欧洲本土循环价值流失。** 二、核心技术体系（全流程一体化闭环） 项目打通**分选→智能预处理→熔体精炼→合金品质数字化管控**全链条，以数字主线（Digital Thread）串联所有工序： ### 1\. AI 多传感器智能分选（源头核心突破） ### 融合多光谱、X 射线、电磁检测多维传感器，搭配 AI 算法自动识别： 区分不同系列铝合金、微量铁 / 铜 / 锌有害合金杂质； 精准识别塑料、涂层、氧化皮、油污非金属污染物；相比传统单一分选，原料纯度大幅提升，从源头减少后端精炼负担。 ### 2\. 闭环式热预处理 ### 密闭低温闭环脱漆工艺，安全分解有机涂层、油污，全程废气集中收集处理，大幅削减 VOC、二噁英排放，无二次污染外泄。 ### 3\. 近零熔剂熔炼精炼技术（标志性指标） ### 开发两套适配工业炉型的超低熔剂方案： 3.1 感应炉专用**近零熔剂工艺**； 3.2 回转炉、反射炉、坩埚炉通用超低熔剂改造方案；配套磁流体搅拌、真空蒸馏、高剪切熔体净化；**核心目标：熔剂使用量最高削减 97%，同时不降低铝金属回收率、不牺牲再生合金力学性能**，从根源大幅减少盐渣产出。 ### 4\. 全生命周期评价（The life-cycle assessment ）数字化工具 ### 搭建标准化周期评价测算模型，覆盖废料预处理、熔炼、合金铸锭全链条，量化新工艺相比传统路线的碳减排、能耗下降、固废减量真实收益，数据基于工厂工业化实测，可用于企业 ESG、欧盟 CBAM 碳关税申报。 三、项目四大战略目标 1. **环保减负：熔剂减量97%，盐渣、温室气体、有毒废气大幅下降，解决再生铝头号环保难题盐渣；** 2. **废料高值化：可利用混杂、重度污染报废铝料生产高端汽车、包装级铝合金，减少废料降级利用与出口外流，留住欧洲本土铝资源价值；** 3. **产业降本：降低辅料、固废处置、尾气治理综合运营成本，提升欧洲再生铝企业全球竞争力；** 4. **产业链协同落地：形成可商业化复制的成套智能再生铝产线方案，适配欧盟循环经济、脱碳、战略原材料自主政策。 四、17家合作方分工模式 1. **高校 / 科研机构：基础冶金机理、AI 物料识别、合金配方、生命周期评价理论研发与实验室验证；** 2. **设备技术供应商：把实验室技术转化为工业化成套分选、熔炼装备；** 3. **再生铝生产企业：提供真实复杂废铝原料、开放中试产线，验证工艺工业化可行性；** 4. **铝行业协会：对接全产业链、推广项目成果；** 5. **政策机构：匹配欧盟循环经济、碳减排法规，保障成果贴合产业政策导向。** 五、17家机构详细名字 欧盟地平线欧洲计划：2026年6月启动该智能再生铝项目，预计总投资733万欧元，周期3年，由欧洲17家机构联合攻关。项目集成AI多传感器分选、闭环预处理、近零熔剂精炼全套技术，目标削减97%熔剂用量，大幅减少盐渣固废，解决混杂废铝难以生产高端合金痛点，配套生命周期评价量化减排收益，助力欧洲锁住本土废铝资源、完善低碳铝循环供应链。 全部 17 家合作机构按国别完整罗列如下： 1\. 英国（2 家） Brunel University London（项目总牵头） Zyomax（AI 智能分选、数字化检测设备企业） 2\. 德国（3 家） RWTH Aachen University 亚琛工业大学（冶金基础研发） Otto Jun...,,,,pending
2026年 能源央企新能源项目投资边界取值,风光储知识库,风光储知识库,,normal,2026-07-17T23:00:00+08:00,,今天给大家分享的是能源央企新能源项目资本金、贷款利率、税金抵扣、折旧费、残值率、用工、保险、摊销等费用比例，收益参数、综合效率等的要求。列举了风电、光伏、储能、绿电交通、绿电转化综合能源项目的边界取值！ 电友们如果觉得不错，烦请点个关注、给个赞，多多分享给周边朋友！谢谢！,https://mp.weixin.qq.com/s/YomCey8gz-l88HqGOFoYAQ,2026-07-18T08:55:32+08:00,,,,,,pending
俄军情周报：俄在构建大规模防空体系方面拥有丰富经验,战略前沿技术,战略前沿技术,,normal,2026-07-17T22:59:59+08:00,远望智库预见未来,远望智库：与智者同行，为创新加速！,https://mp.weixin.qq.com/s/dOqK_pJduZC3nme5bf2lPw,2026-07-18T08:41:06+08:00,俄军情周报：俄在构建大规模防空体系方面拥有丰富经验 原创 远望智库预见未来 远望智库预见未来 战略前沿技术 电话 | 010-82030532 手机 | 18501361766 微信 | tech9999 邮箱 | yw@techxcope.com 动态汇编 **★科装动态★ 搭载AI的Сварог про拦截无人机开始进行实战测试 俄媒援引“斯瓦罗格”（Сварог про）科研生产中心官方代表报道，俄罗斯特别军事行动区的部队开始对最新型的“斯瓦罗格Pro”（Сварог про）无人机拦截器进行实战测试。该机构表示，“在特别军事行动区，配备人工智能引导系统的新型防空无人机（FPV防空系统）...,俄军情周报：俄在构建大规模防空体系方面拥有丰富经验 原创 远望智库预见未来 远望智库预见未来 战略前沿技术 电话 | 010-82030532 手机 | 18501361766 微信 | tech9999 邮箱 | yw@techxcope.com 动态汇编 **★科装动态★ 搭载AI的Сварог про拦截无人机开始进行实战测试 俄媒援引“斯瓦罗格”（Сварог про）科研生产中心官方代表报道，俄罗斯特别军事行动区的部队开始对最新型的“斯瓦罗格Pro”（Сварог про）无人机拦截器进行实战测试。该机构表示，“在特别军事行动区，配备人工智能引导系统的新型防空无人机（FPV防空系统）‘斯瓦罗格Pro’正在进行实战测试。该无人机与负责反无人机作战的机动火力小组协同测试。该装备旨在打击固定翼无人机。该无人机可手动发射，并与地面控制站配合使用，能够在最远17公里的距离上实施打击。它还可以使用战斗部。”该机构补充称，未来计划将该型无人机安装在运输车辆上。该机构代表介绍，“这将使‘斯瓦罗格Pro’能够供机动小组使用，这些小组将出动并负责掩护各类区域，包括工业企业。与雷达集成的该型无人机可让操作人员通过连接自动化控制中心的计算机在车内操作，从而实现对目标的跟踪。”该型无人机采用模拟通信和数字视频技术。该机构代表称，“它是加密的，无法对其进行拦截。这使得任务执行更加高效，因为图像质量也显著提高了。”该型无人机的速度超过300公里/小时，飞行高度可达4公里，装备尺寸为540/410/410毫米。（塔斯社7月2日） 俄“波列-31”电子战系统可压制无人机卫星导航 俄媒从“波列-31”（Поле-31）无线电电子对抗系统研发企业“基洛瓦特”（Киловатт）科研生产联合体了解到，该系统能够在不少于两公里的距离上压制使用卫星导航的无人机。该机构表示，“该站的主要技术优势在于，能在不少于两公里的距离上压制无人机用于定位、导航和执行作战任务的卫星导航信号。”无线电电子对抗系统能够压制使用GPS、格洛纳斯、北斗、伽利略等导航系统的无人机。该机构称，该站安装在高处，用于保护军事基础设施，工业设施，农业领域、电信和关键基础设施等免受无人机侵扰。（塔斯社7月2日） 俄T-80“飞行坦克”在特别军事行动区不负突破性战车美誉 据俄技集团乌拉尔车辆制造厂消息，T-80“飞行坦克”在特别军事行动区证明突破性战车的这一美誉。整整50年前，即1976年7月6日，苏军列装富有传奇色彩的T-80坦克，这是全球首款配装燃气涡轮发动机的量产坦克。消息称，“这头‘无声的猛兽’永久地改变了对重型装甲车辆速度的概念，不负突破性战车的美誉，其速度、静音和令人难以置信的战场生命力在特别军事行动区令人赞不绝口。”50年来T-80各种改进型生产10000多台。现在的T-80BVM是一款经过深入改进的战车，配装现代化的火控系统、红外成像仪、“化石”动态防护、静态油耗降低近一半，适于对抗无人机。（卫星社7月7日） **★战略动态★ 克宫：普京和特朗普都明白双方接触将会继续 俄罗斯总统新闻秘书德米特里·佩斯科夫表示，俄罗斯总统弗拉基米尔·普京和美国总统唐纳德·特朗普都明白，双方将在近期继续接触。佩斯科夫告诉记者，“普京总统和特朗普总统都明白，双方将在近期继续接触。”佩斯科夫说：“最重要的是，特朗普愿意听取普京向他传达的信息。”佩斯科夫说：“俄美两国总统会谈是一个很好的在最高级别由我国总统向美国总统直接传达我们立场的机会。”7月4日早些时候，俄罗斯总统助理尤里·乌沙科夫表示，普京已向特朗普表示，乌克兰及欧洲支持者正试图延长和升级俄乌冲突，并利用恐怖主义手段对付平民。俄罗斯总统助理尤里·乌沙科夫称，俄罗斯总统弗拉基米尔·普京和美国总统唐纳德·特朗普于7月4日进行电话交谈，通话持续近一个半小时。（卫星社7月6日） 军事行动——俄乌冲突专题 **★冲突现状★ 战损情况 自特别军事行动开始以来，俄军累计摧毁673（+0）架固定翼飞机、284（+0）架直升机、177206（+5235）架无人机、665（+1）套防空导弹系统、30070（+102）辆坦克及各式装甲车、1755（+5）台多管火箭炮、35683（+113）门野战火炮和迫击炮、65935（+670）辆特种军车。（俄罗斯国防部2026年7月8日简报，括号里为较2026年6月30日一周时间增加数量） 包括伤亡和致残人员在内的乌军损失人数或达200万 俄国防部军事政治管理总局副局长阿普季·阿拉乌迪诺夫告诉俄媒，乌克兰军队的损失人数可能超过200万，包括阵亡、受伤和永久致残人员。阿拉乌迪诺夫说：“我们早就记录到乌克兰军队的损失人数已经超过200万。”阿拉乌迪诺夫说，乌克兰军队的损失人数几个月前就已超过200万。（卫星社7月7日） 以下图片链接包含《...,,,,pending
美陆军智能化战场利器——SwarmOS智能蜂群控制系统,战略前沿技术,战略前沿技术,,normal,2026-07-17T22:59:59+08:00,赵锋,远望智库：与智者同行，为创新加速！,https://mp.weixin.qq.com/s/BUUaI25khLpHkzLBWcTQ0A,2026-07-18T08:40:59+08:00,美陆军智能化战场利器——SwarmOS智能蜂群控制系统 战略前沿技术 以下文章来源于防务快讯 ，作者赵锋 **防务快讯** . 关注指挥信息系统发展，提供指挥信息系统最新动态。 电话 | 010-82030532 手机 | 18501361766 微信 | tech9999 邮箱 | yw@techxcope.com 来源：防务快讯 作者：赵锋 现代战场的电磁环境日趋复杂，传统集中式、依赖云端或远程指挥的无人机控制模式正面临严峻挑战。2026年6月，美陆军在“常春藤量化演习”中对人工智能蜂群控制软件SwarmOS进行了深度测试。该系统依托去中心化的边缘计算架构，突破了“单人单机”的控制瓶颈，实...,"美陆军智能化战场利器——SwarmOS智能蜂群控制系统 战略前沿技术 以下文章来源于防务快讯 ，作者赵锋 **防务快讯** . 关注指挥信息系统发展，提供指挥信息系统最新动态。 电话 | 010-82030532 手机 | 18501361766 微信 | tech9999 邮箱 | yw@techxcope.com 来源：防务快讯 作者：赵锋 现代战场的电磁环境日趋复杂，传统集中式、依赖云端或远程指挥的无人机控制模式正面临严峻挑战。2026年6月，美陆军在“常春藤量化演习”中对人工智能蜂群控制软件SwarmOS进行了深度测试。该系统依托去中心化的边缘计算架构，突破了“单人单机”的控制瓶颈，实现了单兵对异构无人机群的分布式指挥与自主协同作战。本文将从项目发展背景、系统功能组成、核心技术、试验演习与作战运用，以及未来军事启示五个维度，系统阐述美陆军如何将SwarmOS打造为下一代智能化战场的核心利器。 1、项目发展背景：从“烟囱式”孤岛到“分布式”协同 **1.1 现代反介入/区域拒止（A2/AD）环境的倒逼 传统无人机作战高度依赖大带宽卫星通信、GPS导航及后方云端算力。但在强对抗战场上，敌方的高功率电子干扰、GPS欺骗和网络攻防手段，极易导致无人机“断网、迷航、瘫痪”。美军迫切需要一种能在降级、拒止、间歇性和受限（DDIL）通信环境中稳定运行、自持运行的无人系统。 **1.2 五角大楼对高效杀伤链的迫切追求 “单人控单机”或“多人控单机”的模式不仅占用宝贵的兵力资源，更因数据传输链条过长，导致情报获取到火力打击的响应速度迟缓。美陆军优先发展的核心方向，是通过人工智能压缩“观察-调整-决策-行动”（OODA）循环。SwarmOS正是在这一背景下由美国Palladyne AI公司自主研发，旨在解决无人系统规模化应用中的操作员负荷过载问题，以更少的人力、更高的自主性，构建一条""速度更快、致命性更强""的智能化杀伤链。 图1 单兵通过SwarmOS软件控制无人机蜂群 2、系统功能组成：去中心化边缘AI的架构设计 SwarmOS的核心竞争力不在于某一轻量化无人机平台本身，而在于其作为底层“大脑”的软件栈架构。其系统功能主要由以下三个核心模块交织而成： 图2 SwarmOS操作界面视图 **2.1 边缘计算与（SWaP）受限硬件适配 SwarmOS摆脱了对后方数据中心或云端网络的依赖。其算法经过极致优化，能够在体积、重量和功耗（SWaP）严格受限的微型嵌入式计算芯片上运行。这意味着，前线普通无人机平台即可充当智能计算节点，在网络边缘直接完成实时目标识别、航迹规划与威胁规避。 **2.2 去中心化自主协同架构 系统摒弃了单一指挥节点的脆弱模式，采用基于群智涌现的自组织网络。各无人机节点的机载传感器（如光电红外摄像头、雷达、射频节点）独立采集数据并在本地过滤处理，仅在节点间共享提炼后的结构化“洞察”，从而在蜂群内部自发形成动态环境态势图。 图3 SwarmOS系统界面呈现的单兵多任务环境态势图 **2.3 多源异构平台的跨厂家互操作性 SwarmOS具备强大的硬件抽象能力。它打破了不同军工企业、不同接口标准之间的“烟囱式”壁垒。无论是四旋翼侦察无人机、固定翼长航时巡逻机，还是像“Gremlin-X”这样的巡飞弹（微型轰炸机），都能在SwarmOS的统一接口下无缝纳入同一协同指挥网络。 3、核心技术：完全断网（无云端连接）下的蜂群协同保障 在强电子对抗和无线电静默的极端战场条件下，SwarmOS之所以能在完全断网、无GPS、无外部基站的状态下保障无人蜂群安全高效协同，主要依赖以下四项专为边缘强对抗环境优化的底层机制： **3.1 边缘原生计算与本地决策 SwarmOS 的核心理念是“边缘自主行动，而非云端思考”。软件栈完全运行在单架无人机搭载的轻量化机载芯片内。目标识别、航迹规划和威胁规避全部在本地数毫秒内解算完成，无需将原始海量数据传回后方，从根本上切断对外部算力和远程云端的依赖。 **3.2 “特征化”通信与极致带宽压缩 在断绝外部连网时，蜂群内部仅通过战术数据链维持基础的机间沟通。SwarmOS 采取“不传流媒体，只传洞察”的策略，严禁传输高清视频流等高带宽数据。机载AI仅将目标提炼为“坐标(X,Y)、目标属性、速度”等几个字节的超轻量化结构化数据。这种极致的带宽压缩，确保了局部无线电信号在遭遇敌方强力电子压制时，依然能凭借微弱的信号完成蜂群内部的断续通信。 **3.3 分布式环境态势融合 由于没有中央服务器汇总全局地图，SwarmOS采用了类似生物群落（如蚁群）的分布式融合技术。每架无人机将本地传感器捕获的局部信息与接收到的邻近同伴特征数据就地融合，在各自“大脑”中生成一份动态、对称的局部环境模型。即使部分节点因地形遮挡短暂失联，也能基...",,,,pending
